[
  {
    "id": "abe53e559b52",
    "date_found": "2026-07-13",
    "title": "6 вещей, которые Claude Code реально закрывает в малой компании",
    "summary": "Обзорная карта: где Claude Code (ассистент-программист, который работает прямо в папке проекта) приносит пользу небольшому бизнесу — от рутины и таблиц до сайта, ботов и внутренних мини-инструментов. По одному живому примеру на каждое.",
    "details": "**Зачем.** Чтобы за пять минут понять, за что вообще браться с Claude Code, а что пока не ваш случай. Claude Code — это ассистент-программист, который работает прямо в папке вашего проекта: сам читает и правит файлы, запускает команды. Дальше по разделам будут детали, здесь — общая карта из шести направлений.\n\n**Как.** Шесть зон пользы, по живому примеру на каждую:\n\n1. Рутина и автоматизация — «переименуй 300 фото товаров по артикулу и разложи по папкам», «собери из десяти выгрузок один прайс».\n2. Сайт и интернет-магазин — «поменяй текст и кнопку на странице доставки», «добавь фильтр по бренду в каталог», «почини вёрстку карточки на телефоне».\n3. Данные и таблицы — «посчитай выручку по менеджерам из этой Excel-выгрузки и сделай сводку», «найди дубли клиентов в CSV».\n4. Боты и интеграции — «сделай простого Telegram-бота, который принимает заявку и шлёт её на почту».\n5. Документы и тексты — «сгенерируй 50 описаний товаров по шаблону», «переведи инструкцию и оформи в PDF».\n6. Внутренние мини-инструменты — «страничка, где сотрудник вводит данные и получает готовый акт».\n\n**Подвох.** Claude Code силён там, где есть файлы, чёткая задача и способ проверить результат. Он не заменит бухгалтера, юриста или маркетолога — он ускоряет ручную возню вокруг них. Начинайте с мелких обратимых задач на копии данных, а не сразу на боевом магазине.",
    "tags": [
      "возможности"
    ],
    "source_url": "https://code.claude.com/docs/en/common-workflows#six-things",
    "source_platform": "docs",
    "author": "Claude Code Docs",
    "published_at": "2026-07-13",
    "confidence": "high"
  },
  {
    "id": "f2cb71a42463",
    "date_found": "2026-07-13",
    "title": "Когда нужен MCP, а когда нет — простыми словами",
    "summary": "MCP — способ подключить Claude Code к внешнему сервису (Google-таблицы, база магазина, Notion, почта), чтобы он читал и менял данные там напрямую. Разбираем, когда это оправдано на ваших задачах, а когда лишнее усложнение.",
    "details": "**Зачем.** MCP (Model Context Protocol) — «переходник», через который Claude Code получает доступ к внешнему сервису: базе вашего магазина, Google-таблицам, Notion, трекеру задач, почте. Нужен, когда вы ловите себя на том, что вручную копируете данные из одной системы в чат и обратно. Пример: «возьми новые заказы из базы, посчитай остатки и подготовь черновики писем поставщикам».\n\n**Как.** Подключается одной командой в терминале. Примеры: `claude mcp add --transport http notion https://mcp.notion.com/mcp` — подключить Notion; для сервиса с ключом доступа — `claude mcp add --env API_KEY=ваш_ключ --transport stdio имя -- npx <сервер>`. После этого просто просите задачу словами — Claude сам ходит в сервис. Готовые проверенные коннекторы есть в каталоге Anthropic. Начните с одного сервиса, где реально болит ручное копирование.\n\n**Подвох.** MCP — не обязательный первый шаг. Пока задачи живут в файлах и выгрузках (Excel, CSV, папка с сайтом), MCP не нужен: Claude Code и так их читает. Подключение внешней системы = доступ к боевым данным. Давайте ключи только с минимальными правами (лучше «только чтение»), не подключайте продакшн-базу «на попробовать» и не вставляйте секреты в общие файлы, которые уходят в git (git — система хранения истории кода, её видит вся команда).",
    "tags": [
      "возможности",
      "mcp"
    ],
    "source_url": "https://code.claude.com/docs/en/mcp",
    "source_platform": "docs",
    "author": "Claude Code Docs",
    "published_at": "2026-07-13",
    "confidence": "high"
  },
  {
    "id": "e0fa87b3264a",
    "date_found": "2026-07-13",
    "title": "Субагенты и хуки: надо ли вам на начальном+?",
    "summary": "Субагент — отдельный «помощник помощника» под узкую задачу; хук — команда, которая срабатывает сама на событие. Честно: на уровне начальный+ почти всегда рано. Разбираем, когда реально пора, а когда не стоит.",
    "details": "**Зачем.** Чтобы не тратить недели на «продвинутые» фишки, которые вам пока не нужны. Субагент — это отдельный Claude под узкую задачу (например, «только ищи по коду и возвращай короткую выжимку»), со своей памятью и ограниченным набором инструментов. Хук (hook) — ваша команда, которая срабатывает автоматически на событие: например, прогнать проверку после каждой правки файла.\n\n**Как.** Если всё же дозрели: субагент — это файл `.claude/agents/имя.md` с описанием роли и списком разрешённых инструментов (создаётся в пару строк, есть команда `/agents` как подсказка). Хуки настраиваются в `settings.json` — привязываете команду к событию вроде PostToolUse (после действия Claude). Признак, что пора субагентам: одну и ту же объёмную возню (разбор логов, ресёрч) гоняете постоянно, и она засоряет основной диалог. Признак, что пора хукам: есть проверка, которую вы забываете запускать руками каждый раз.\n\n**Подвох.** На уровне начальный+ это почти всегда преждевременно. 90% пользы вы получите от обычного диалога, слэш-команд и скиллов. Не осваивайте субагентов и хуки «ради галочки»: неудачный хук может молча ломать или блокировать работу, а лишние субагенты усложняют то, что делалось одной просьбой. Вернитесь сюда, когда конкретная боль появится сама.",
    "tags": [
      "возможности",
      "subagents",
      "hooks"
    ],
    "source_url": "https://code.claude.com/docs/en/sub-agents",
    "source_platform": "docs",
    "author": "Claude Code Docs",
    "published_at": "2026-07-13",
    "confidence": "high"
  },
  {
    "id": "c439d812bc18",
    "date_found": "2026-07-13",
    "title": "Скиллы и слэш-команды: повторяющуюся задачу — в одну команду",
    "summary": "Если раз за разом объясняете одно и то же (сверстать письмо, оформить карточку товара), сохраните инструкцию один раз и вызывайте своей командой «/имя». Это и есть слэш-команды и скиллы.",
    "details": "**Зачем.** Слэш-команда (короткая команда с «/», как встроенная `/help`) и скилл нужны, когда вы копируете в чат одну и ту же инструкцию. Пример из магазина: каждую неделю просите «оформи карточку товара по нашему шаблону — заголовок, 5 буллетов выгод, SEO-описание на 300 знаков». Сохраните это один раз — и вызывайте как `/kartochka`.\n\n**Как.** Самый простой вариант: создайте файл `.claude/commands/имя.md` в проекте (или `~/.claude/commands/имя.md` — тогда команда работает во всех проектах) и впишите туда инструкцию обычным текстом. Имя файла = имя команды. Нужны подстановки — используйте `$ARGUMENTS`: команда `/opisanie ноутбук Lenovo` подставит «ноутбук Lenovo» в ваш текст. Скилл — вариант посложнее: папка `.claude/skills/имя/SKILL.md` с коротким описанием в начале; Claude сам подхватывает его, когда задача подходит.\n\n**Подвох.** Команда экономит время, только если задача действительно повторяется — на разовое дело её заводить дольше, чем просто сделать. Держите инструкцию конкретной (шаблон, критерии, пример), иначе результат будет плавать от раза к разу. И помните: файлы в `.claude/` в общем репозитории видит вся команда — не кладите туда пароли и ключи.",
    "tags": [
      "возможности",
      "skills",
      "slash-commands"
    ],
    "source_url": "https://code.claude.com/docs/en/slash-commands",
    "source_platform": "docs",
    "author": "Claude Code Docs",
    "published_at": "2026-07-13",
    "confidence": "high"
  },
  {
    "id": "a49f6da27026",
    "date_found": "2026-07-13",
    "title": "Где Claude Code НЕ помощник — честные границы",
    "summary": "Чтобы не терять время и деньги — задачи, которые не стоит поручать Claude Code вслепую: необратимые действия без проверки, «сделай красиво» без критерия готовности, ответственные юридические и финансовые решения.",
    "details": "**Зачем.** Знать границы важнее, чем знать фишки: одна неудачная автоматизация на боевых данных стоит дороже, чем весь сэкономленный месяц. Этот разбор — про то, что НЕ стоит поручать, чтобы не потерять деньги и нервы.\n\n**Как.** Держитесь подальше от четырёх зон:\n\n1. Необратимые действия без проверки — «удали старые заказы», «разошли письма всем клиентам», массовые правки прямо на боевом магазине. Сначала копия или тест, показ плана, и только потом запуск.\n2. Задачи без критерия готовности — «сделай красиво», «увеличь продажи». Claude не угадает, что для вас «готово»; сформулируйте измеримый результат.\n3. Ответственные решения — юридические, налоговые, медицинские, крупные финансовые. Claude Code поможет собрать данные, но решение и проверку оставьте человеку-эксперту.\n4. То, что вы сами не сможете проверить. Если не понимаете, правильный ли результат, вы не заметите ошибку — берите задачи, где итог видно глазами.\n\n**Подвох.** Claude Code уверенно звучит даже когда ошибается — может «придумать» несуществующую функцию или тихо задеть соседнее. Правило новичка: работать на копии, просить сначала план и делать резервную копию (бэкап) данных перед любой массовой операцией. Ответственность за результат остаётся на вас.",
    "tags": [
      "возможности"
    ],
    "source_url": "https://code.claude.com/docs/en/common-workflows#where-not",
    "source_platform": "docs",
    "author": "Claude Code Docs",
    "published_at": "2026-07-13",
    "confidence": "high"
  }
]
