[
  {
    "id": "25fff7693285",
    "date_found": "2026-07-13",
    "title": "С чего начать здесь: как устроен практикум",
    "summary": "Это не лента новостей, а тренировочный справочник по Claude Code для реальной работы. Карточка — суть, «подробнее» — разбор Зачем / Как / Подвох. Начните с раздела «Что умеет Claude Code».",
    "details": "**Зачем.** Основной радар отвечает на «что нового в мире Claude Code». Этот — на «что применить в моих проектах на моём уровне»: автоматизация, интернет-магазин, небольшие сервисы. Всё написано для уровня начальный+, без жаргона и воды.\n\n**Как.** Наверху есть выбор раздела (то, что подписано «День» — на самом деле раздел): «Что умеет Claude Code» — карта возможностей, «Проверка» — как не сломать рабочее, «Старт и структура» — как завести проект, «Рецепты» — готовые пошаговые сценарии под ваши задачи. На карточке — суть и блок «Зачем»; нажмите «подробнее», чтобы увидеть полный разбор Зачем / Как / Подвох. Этот раздел «Свежая доза» обновляется — сюда добавляются новые приёмы под бизнес.\n\n**Подвох.** Не пытайтесь освоить всё сразу и не гонитесь за каждой новой фишкой — это путь к разочарованию. Берите по одному приёму, пробуйте прямо в своём проекте, возвращайтесь, когда упрётесь в конкретную задачу.",
    "tags": ["возможности"],
    "source_url": "https://code.claude.com/docs/en/quickstart",
    "source_platform": "docs",
    "author": "Claude Code — практикум",
    "published_at": "2026-07-13",
    "confidence": "high"
  },
  {
    "id": "3e0bc77c89a6",
    "date_found": "2026-07-13",
    "title": "Приём недели: /doctor — навести порядок в настройке одной командой",
    "summary": "Команда /doctor (алиас /checkup) проверяет вашу настройку Claude Code: находит лишнее, предлагает ужать память проекта, обновляет CLI. Полезно новичку — не надо разбираться руками.",
    "details": "**Зачем.** Когда только осваиваешься, легко насобирать лишнего (ненужные расширения, раздутый CLAUDE.md) и не заметить, что что-то настроено криво. `/doctor` показывает состояние простым списком — как техосмотр для машины.\n\n**Как.** В работающем Claude Code наберите команду `/doctor` (или `/checkup`). Он проверит окружение, подсветит неиспользуемые скиллы и подключения, предложит сократить память проекта и обновить программу. Пробегитесь по списку и примите то, что предлагает, если непонятных рисков нет. Делайте раз в пару недель.\n\n**Подвох.** Это помощник, а не автопилот: он советует, но решение за вами — не удаляйте то, в чём не уверены, что оно не используется. И это про настройку инструмента, а не про ваш код — он не проверит, правильно ли работает ваш магазин.",
    "tags": ["возможности", "slash-commands"],
    "source_url": "https://code.claude.com/docs/en/changelog#doctor",
    "source_platform": "docs",
    "author": "Claude Code Docs",
    "published_at": "2026-07-13",
    "confidence": "high"
  },
  {
    "id": "d7b818da519e",
    "date_found": "2026-07-13",
    "title": "Приём: сначала план, потом код — чтобы Клод не бросался делать наугад",
    "summary": "Прежде чем поручать задачу, попросите Клода составить план из шагов и согласуйте его. Так вы поймёте, что он собирается делать, и поймаете ошибку до того, как он что-то напишет.",
    "details": "**Зачем.** Частая беда новичка: даёшь задачу — Клод сразу пишет код, уходит не туда, а вы понимаете это, когда уже наломано. План перед делом снимает половину таких случаев и стоит одной фразы.\n\n**Как.** Вместо «сделай X» напишите: «Не пиши код сразу. Сначала составь план из шагов, как ты будешь делать X, и покажи мне на согласование». Прочитайте план, поправьте, если шаг не туда, и только потом: «Хорошо, делай по этому плану». Особенно важно для правок магазина и всего, что трогает рабочее.\n\n**Подвох.** План не гарантия — Клод может отклониться по ходу. Поэтому после работы всё равно просите показать, что именно изменилось (см. раздел «Проверка»). И не заваливайте план мелочами: он для задач в несколько шагов, а не для «поменяй цвет кнопки».",
    "tags": ["prompting", "старт"],
    "source_url": "https://code.claude.com/docs/en/common-workflows#plan",
    "source_platform": "docs",
    "author": "Claude Code Docs",
    "published_at": "2026-07-13",
    "confidence": "high"
  },
  {
    "id": "d1701d4165a0",
    "date_found": "2026-07-13",
    "title": "Приём: /rewind — откатить, если Клод натворил лишнего",
    "summary": "Команда /rewind возвращает разговор и изменения к более раннему состоянию — как «отмена» для сессии. Страховка, когда что-то пошло не так и хочется откатиться на пару шагов.",
    "details": "**Зачем.** Иногда Клод в ходе работы меняет больше, чем нужно, или уводит проект не туда. Начинать всё заново жалко. `/rewind` даёт вернуться к точке, где всё ещё было хорошо, не теряя весь разговор.\n\n**Как.** Наберите команду `/rewind` — Claude Code предложит вернуться к более раннему состоянию беседы и связанных изменений. Выберите точку до того, как всё пошло не так. Это быстрее, чем вручную отменять правки. Для настоящей страховки на живых проектах всё равно держите git (см. «Проверка: git как машина времени») — он переживёт закрытие программы.\n\n**Подвох.** `/rewind` работает в пределах сессии и не заменяет полноценные бэкапы: закрыли программу — история может не сохраниться так, как вы ждёте. Для важного (магазин, боевые данные) git и копия обязательны, `/rewind` — быстрая отмена «на месте».",
    "tags": ["возможности", "slash-commands", "безопасность"],
    "source_url": "https://code.claude.com/docs/en/changelog#rewind",
    "source_platform": "docs",
    "author": "Claude Code Docs",
    "published_at": "2026-07-13",
    "confidence": "high"
  }
]
