[
  {
    "id": "7491401dec4d",
    "date_found": "2026-07-13",
    "title": "Правило «сначала на копии»: меняем магазин, не трогая живой",
    "summary": "Никогда не правьте живой магазин напрямую. Сделайте отдельную копию сайта, все изменения обкатывайте на ней, а в рабочий магазин выкатывайте только проверенное — тогда поломка не заденет реальных клиентов.",
    "details": "**Зачем.** Живой магазин — это деньги и клиенты прямо сейчас. Если Клод что-то сломает прямо в нём, покупатели увидят битые страницы и уйдут. Копия сайта (её ещё зовут «тестовой» или staging — от англ. «промежуточная») — это отдельная, точно такая же версия, которую видите только вы. На ней можно смело ошибаться.\n\n**Как.**\n1. Заведите отдельную «песочницу». Простой вариант — попросите Клода: «сделай копию проекта в отдельной папке, чтобы я мог экспериментировать, не трогая рабочий сайт». Другой вариант — «ветка» (branch): это вторая линия правок внутри того же проекта. Скажите: «создай новую ветку test и работай в ней».\n2. Все правки от Клода — только в этой копии или ветке, живой сайт не трогаем.\n3. Проверьте результат на копии (см. чек-лист приёмки).\n4. Убедились, что всё работает — переносите изменения в живой магазин (это называется «выкатить»). Фраза Клоду: «покажи, как перенести проверенные изменения в рабочую версию».\n\n**Подвох.** Копия не даёт полной защиты. База с реальными заказами, оплата и письма клиентам могут быть общими у копии и живого сайта — уточните у Клода: «работает ли эта копия с настоящими заказами и оплатой?». И копию надо иногда обновлять до состояния живого сайта, иначе проверяете на устаревшем.",
    "tags": [
      "проверка",
      "магазин",
      "безопасность"
    ],
    "source_url": "https://code.claude.com/docs/en/common-workflows#run-parallel-sessions-with-worktrees",
    "source_platform": "docs",
    "author": "Claude Code Docs",
    "published_at": "2026-07-13",
    "confidence": "high"
  },
  {
    "id": "7098e3750d5d",
    "date_found": "2026-07-13",
    "title": "Заставьте Клода объяснить, что он изменил, — до того как принять",
    "summary": "Перед тем как принять правку, просите Клода показать список изменений и объяснить их простыми словами. Не соглашайтесь вслепую — так опасное всплывёт до того, как попадёт в магазин.",
    "details": "**Зачем.** Клод пишет код быстро, и легко нажать «принять», не поняв, что именно поменялось. Если правка задела оформление заказа или цены — узнаете об этом от разгневанных клиентов. Одна минута на объяснение экономит часы разбора поломки.\n\n**Как.** Скажите Клоду эти фразы (промпт — это ваш текстовый запрос) перед тем как принять:\n- «Покажи списком, какие файлы и что именно ты изменил.»\n- «Объясни простыми словами, без терминов, что делает это изменение и на что в магазине оно влияет.»\n- «Что может сломаться из-за этой правки? Назови риски.»\n- «Ты трогал корзину, оформление заказа, оплату или цены?»\n- Если непонятно: «Объясни ещё проще, как будто мне 10 лет.»\nПринимайте только после понятного ответа. Удобно включить «режим плана» (plan mode): Клод сперва распишет, что собирается сделать, и не тронет ни одного файла, пока вы не одобрите. Включается кнопкой Shift+Tab прямо в сессии.\n\n**Подвох.** Объяснение Клода — это его пересказ собственных действий; он бывает излишне уверен и может упустить побочный эффект. Поэтому объяснение не заменяет реальную проверку руками и работу на копии. Правило: понял → проверил на копии → выкатил.",
    "tags": [
      "проверка",
      "prompting"
    ],
    "source_url": "https://code.claude.com/docs/en/common-workflows#plan-before-editing",
    "source_platform": "docs",
    "author": "Claude Code Docs",
    "published_at": "2026-07-13",
    "confidence": "high"
  },
  {
    "id": "5923f0d3ed08",
    "date_found": "2026-07-13",
    "title": "Чек-лист приёмки: что проверить руками после правок магазина",
    "summary": "После каждой правки пройдите короткий чек-лист: открывается ли сайт, работают ли корзина и оформление заказа, не сломались ли соседние страницы, целы ли данные. Пять минут — и спите спокойно.",
    "details": "**Зачем.** Клод говорит «готово», но у него «готово» значит «я сделал, что просили», а не «в магазине всё живо». Проверить это может только человек, глазами. Особенно то, что приносит деньги: корзину и оплату.\n\n**Как.** Откройте сайт в браузере и пройдите руками после каждой правки:\n1. Сайт вообще открывается? Главная грузится без ошибок и без «белого экрана»?\n2. Карточка товара открывается, товар добавляется в корзину?\n3. Оформление заказа проходит до конца — адрес, доставка, оплата? Сделайте тестовый заказ.\n4. Соседние страницы, которые не трогали, тоже целы? Откройте 3-4 наугад.\n5. Данные на месте: список товаров, цены и прошлые заказы не пропали и не обнулились?\n6. На телефоне тоже нормально? Откройте с мобильного — оттуда покупает половина клиентов.\n7. Нет ли скрытых ошибок? Нажмите F12 → вкладка Console (красные строки — это ошибки), или просто спросите Клода: «как проверить, нет ли ошибок на странице оформления заказа?».\nСовет: сохраните этот список и просите Клода дописывать пункты под ваш магазин.\n\n**Подвох.** Ручная проверка ловит очевидное, но не всё — редкие сценарии (оплата конкретной картой, товар со скидкой) легко пропустить. Проверяйте в первую очередь то, чем реально пользуются клиенты, и держите копию, чтобы тестовый заказ не путался с настоящими.",
    "tags": [
      "проверка",
      "магазин"
    ],
    "source_url": "https://code.claude.com/docs/en/common-workflows#prompt-recipes",
    "source_platform": "docs",
    "author": "Claude Code Docs",
    "published_at": "2026-07-13",
    "confidence": "high"
  },
  {
    "id": "2a10e5c5b2db",
    "date_found": "2026-07-13",
    "title": "Git как страховка: «машина времени» для вашего проекта",
    "summary": "Git — это машина времени проекта: сохраняете точки состояния и, если сломалось, откатываетесь к последней рабочей. Не-программисту хватит двух действий: сохранить точку и вернуться назад.",
    "details": "**Зачем.** Самый большой страх — «а вдруг сломаю и не смогу вернуть как было». Git снимает этот страх: это встроенная в проект машина времени. Сохранили точку перед правкой — и в любой момент вернёте проект ровно в то состояние.\n\n**Как.** Термины по-простому: коммит (commit) — сохранённая точка состояния всего проекта с подписью; откат — возврат к такой точке. Команды помнить не нужно, просите Клода словами:\n1. Перед правкой: «сделай коммит текущего состояния с подписью \"рабочая версия до правок\", чтобы я мог откатиться». Это ваша точка возврата.\n2. Делаете правку, проверяете по чек-листу.\n3. Всё хорошо: «сохрани изменения новым коммитом с понятной подписью».\n4. Сломалось: «откати проект к последнему коммиту, верни как было» — файлы вернутся в сохранённое состояние.\n5. Раз в день полезно: «покажи историю коммитов простым списком» — это все ваши точки возврата.\n\n**Подвох.** Git возвращает файлы проекта, но НЕ базу с реальными заказами и НЕ то, что уже выкатано на живой сайт. Если удалили заказы клиентов — git их не вернёт, для этого нужен отдельный бэкап (backup — резервная копия данных). И откат стирает несохранённые правки, сделанные после точки, — поэтому сохраняйтесь коммитами почаще.",
    "tags": [
      "проверка",
      "git",
      "безопасность"
    ],
    "source_url": "https://code.claude.com/docs/en/common-workflows",
    "source_platform": "docs",
    "author": "Claude Code Docs",
    "published_at": "2026-07-13",
    "confidence": "high"
  },
  {
    "id": "eaf604cbf2bb",
    "date_found": "2026-07-13",
    "title": "Просите у Клода авто-проверки на человеческом языке",
    "summary": "Автопроверки (тесты) — это маленькие программы-сторожа: сами проверяют, что важное работает. Их можно заказать Клоду обычными словами, чтобы поломку ловил компьютер, а не клиент.",
    "details": "**Зачем.** Ручной чек-лист вы проходите, только когда про него помните. Автопроверка (тест) — это программа-сторож, которая проверяет то же самое сама, каждый раз и за секунды. Один раз настроили — и поломка в корзине всплывёт у вас, а не у покупателя.\n\n**Как.** Знать, как тесты устроены внутри, не нужно — описывайте словами, что должно работать:\n- «Добавь простую автопроверку: товар добавляется в корзину и сумма считается верно.»\n- «Сделай тест, который проверяет, что страница оформления заказа открывается без ошибок.»\n- «Напиши проверку: при пустой корзине нельзя оформить заказ.»\n- «Запусти все проверки и объясни простыми словами, что прошло, а что нет.»\n- После каждой крупной правки: «прогони проверки и скажи, ничего ли я не сломал.»\nНачните с 2-3 проверок на самое денежное — корзина, заказ, оплата, — остальное добавите позже.\n\n**Подвох.** Тесты проверяют только то, что вы попросили проверить: чего не описали — того не поймают. Плюс их надо иногда обновлять под изменения магазина. Это не замена ручной приёмке и копии, а третий слой страховки: копия + чек-лист + автопроверки.",
    "tags": [
      "проверка",
      "prompting"
    ],
    "source_url": "https://code.claude.com/docs/en/common-workflows#prompt-recipes",
    "source_platform": "docs",
    "author": "Claude Code Docs",
    "published_at": "2026-07-13",
    "confidence": "high"
  }
]
