[
  {
    "id": "4f082f79f0d3",
    "date_found": "2026-07-03",
    "title": "Показать HN: Сделайте свой терминальный импульс оранжевым, когда Claude Code нуждается в вводе",
    "summary": "3 баллов, 0 комментов на Hacker News.",
    "details": "",
    "tags": [
      "tips"
    ],
    "source_url": "https://github.com/rickardstureborg/claude-needs-input",
    "source_platform": "hn",
    "author": "rstureborg",
    "published_at": "2026-07-03",
    "confidence": "low"
  },
  {
    "id": "af29d95e4cbd",
    "date_found": "2026-07-03",
    "title": "hyunhoonj/ASSC2026 — ASSC 29 (Santiago 2026) персональный спутник для сеанса — Claude Code + git",
    "summary": "ASSC 29 (Сантьяго 2026) личная сессия - заметки компаньона — Claude Code + git ★0",
    "details": "",
    "tags": [
      "tips"
    ],
    "source_url": "https://github.com/hyunhoonj/ASSC2026",
    "source_platform": "github",
    "author": "hyunhoonj",
    "published_at": "2026-07-03",
    "confidence": "low"
  },
  {
    "id": "bc91059df23b",
    "date_found": "2026-07-03",
    "title": "Claude получил новый навык - /dataviz",
    "summary": "Видео на YouTube от DIY Smart Code про Claude Code.",
    "details": "",
    "tags": [
      "skills"
    ],
    "source_url": "https://www.youtube.com/shorts/jFdi6qtCE3U",
    "source_platform": "youtube",
    "author": "DIY Smart Code",
    "published_at": "2026-07-03",
    "confidence": "low"
  },
  {
    "id": "0c10ecdd4a10",
    "date_found": "2026-07-03",
    "title": "Show HN: Втягивание расшифровок Claude Code в сеанс Codex и наоборот",
    "summary": "4 баллов, 0 комментов на Hacker News.",
    "details": "",
    "tags": [
      "tips"
    ],
    "source_url": "https://contextify.sh/",
    "source_platform": "hn",
    "author": "bredren",
    "published_at": "2026-07-03",
    "confidence": "low"
  },
  {
    "id": "99d654daa618",
    "date_found": "2026-07-03",
    "title": "sadjow/claude-code-nix — Всегда актуальный пакет Nix для Claude Code с ежечасными обновлениями из родных релизов Anthropic",
    "summary": "Всегда актуальный пакет NIX для Claude Code с ежечасными обновлениями от собственных релизов Anthropic ★444",
    "details": "",
    "tags": [
      "tips"
    ],
    "source_url": "https://github.com/sadjow/claude-code-nix",
    "source_platform": "github",
    "author": "sadjow",
    "published_at": "2026-07-03",
    "confidence": "low"
  },
  {
    "id": "e1fcf77efb8d",
    "date_found": "2026-07-03",
    "title": "Alibaba запрещает сотрудникам использовать Claude Code из-за проблем с антропным шпионским ПО",
    "summary": "4 баллов, 2 комментов на Hacker News.",
    "details": "",
    "tags": [
      "tips"
    ],
    "source_url": "https://www.scmp.com/tech/big-tech/article/3359375/alibaba-bans-staff-using-claude-code-over-anthropic-spyware-concerns",
    "source_platform": "hn",
    "author": "dstala",
    "published_at": "2026-07-03",
    "confidence": "low"
  },
  {
    "id": "8c78b2a19e2e",
    "date_found": "2026-07-03",
    "title": "NexaDuo/mARC — mARC · Multi-Agent Relay Control — устанавливаемая команда инженеров ИИ для Claude Code. Технический руководитель организует работу специалиста с...",
    "summary": "mARC · Multi-Agent Relay Control — устанавливаемая команда инженеров ИИ для Claude Code. Технический руководитель организует специализированные субагенты (dev · SRE · design · security), применяет шлюз безопасности перед слиянием и запускается в любом репозитории через один плагин. ★2",
    "details": "",
    "tags": [
      "subagents"
    ],
    "source_url": "https://github.com/NexaDuo/mARC",
    "source_platform": "github",
    "author": "NexaDuo",
    "published_at": "2026-07-03",
    "confidence": "low"
  },
  {
    "id": "e15be7a0c1df",
    "date_found": "2026-07-03",
    "title": "Claude Code Dynamic Island на macOS",
    "summary": "3 баллов, 1 комментов на Hacker News.",
    "details": "",
    "tags": [
      "tips"
    ],
    "source_url": "https://pookify.vercel.app/",
    "source_platform": "hn",
    "author": "eyadh",
    "published_at": "2026-07-03",
    "confidence": "low"
  },
  {
    "id": "532db89407fc",
    "date_found": "2026-07-03",
    "title": "acerigor/Dialpad-pages-for-claude-code",
    "summary": "GitHub-репозиторий acerigor/Dialpad-pages-for-claude-code. ★0",
    "details": "",
    "tags": [
      "tips"
    ],
    "source_url": "https://github.com/acerigor/Dialpad-pages-for-claude-code",
    "source_platform": "github",
    "author": "acerigor",
    "published_at": "2026-07-03",
    "confidence": "low"
  },
  {
    "id": "63d15fcb7cb9",
    "date_found": "2026-07-03",
    "title": "Alibaba запретит Claude Code на рабочем месте из-за предполагаемых рисков бэкдора, говорит источник",
    "summary": "304 баллов, 261 комментов на Hacker News.",
    "details": "",
    "tags": [
      "tips"
    ],
    "source_url": "https://www.reuters.com/world/china/alibaba-ban-claude-code-workplace-over-alleged-backdoor-risks-source-says-2026-07-03/",
    "source_platform": "hn",
    "author": "nsoonhui",
    "published_at": "2026-07-03",
    "confidence": "low"
  },
  {
    "id": "06cea88734e5",
    "date_found": "2026-07-03",
    "title": "malakazlan/claude-security-skill — оркестратор аудита безопасности для репозиториев кода.",
    "summary": "Оркестратор аудита безопасности для репозиториев кода. ★0",
    "details": "",
    "tags": [
      "subagents",
      "skills"
    ],
    "source_url": "https://github.com/malakazlan/claude-security-skill",
    "source_platform": "github",
    "author": "malakazlan",
    "published_at": "2026-07-03",
    "confidence": "low"
  },
  {
    "id": "a03343527171",
    "date_found": "2026-07-03",
    "title": "Настройки Claude Code, которые сделали меня более быстрым архитектором программного обеспечения",
    "summary": "3 баллов, 0 комментов на Hacker News.",
    "details": "",
    "tags": [
      "tips"
    ],
    "source_url": "https://jsdev.space/claude-code-settings-software-architect/",
    "source_platform": "hn",
    "author": "javatuts",
    "published_at": "2026-07-03",
    "confidence": "low"
  },
  {
    "id": "a2de909442af",
    "date_found": "2026-07-03",
    "title": "pffigueiredo/code-agent-eval — библиотека TypeScript для оценки подсказок против агентов кодирования (Claude Code, Cursor и т. д.) с несколькими буквами...",
    "summary": "Библиотека TypeScript для оценки подсказок против агентов кодирования (Claude Code, Cursor и т. д.) с многоитерационным тестированием и оценкой ★0",
    "details": "",
    "tags": [
      "testing",
      "prompting",
      "ide-integration"
    ],
    "source_url": "https://github.com/pffigueiredo/code-agent-eval",
    "source_platform": "github",
    "author": "pffigueiredo",
    "published_at": "2026-07-03",
    "confidence": "low"
  },
  {
    "id": "0c59889fd39f",
    "date_found": "2026-07-03",
    "title": "Доказательство того, что Claude знает вас по вашему стилю кода: Author2Vec",
    "summary": "4 баллов, 1 комментов на Hacker News.",
    "details": "",
    "tags": [
      "tips"
    ],
    "source_url": "https://author2vec.com/",
    "source_platform": "hn",
    "author": "tristenharr",
    "published_at": "2026-07-03",
    "confidence": "low"
  },
  {
    "id": "fb3f2dad879b",
    "date_found": "2026-07-03",
    "title": "lis186/ccxray — рентгеновское зрение для сеансов ИИ-агента — прозрачный HTTP-прокси и дашборд для Claude Code",
    "summary": "Рентгеновское зрение для сеансов ИИ-агента — прозрачный HTTP-прокси и дашборд для Claude Code ★201",
    "details": "",
    "tags": [
      "tips"
    ],
    "source_url": "https://github.com/lis186/ccxray",
    "source_platform": "github",
    "author": "lis186",
    "published_at": "2026-07-03",
    "confidence": "low"
  }
]