[
  {
    "id": "67e3cd3327e1",
    "date_found": "2026-07-13",
    "title": "Рецепт: автоматизировать обработку заявок (почта/форма → таблица)",
    "summary": "Заявки из почты или веб-формы сами раскладываются в аккуратную таблицу (дата, имя, контакт, суть) — без ручного копирования. Пошагово: что сложить в папку, что сказать Клоду и как проверить на первых заявках.",
    "details": "**Зачем.** Заявки приходят в почту и веб-форму, а вы вручную переносите их в таблицу (имя, телефон, что хотят, дата). Это долго, легко ошибиться и потерять клиента. Хотим, чтобы заявки сами складывались в аккуратную таблицу.\n\n**Как.**\n1. Заведите папку-проект и положите в неё несколько реальных заявок как «сырьё»: сохраните 5–10 писем в текстовые файлы или выгрузите заявки с сайта в файл (CSV/Excel — обычная таблица).\n2. Создайте пустой файл-таблицу, например `заявки.csv`, и решите, какие колонки нужны: дата, имя, контакт, суть запроса, источник.\n3. Запустите Claude Code в этой папке (команда `claude`) и скажите простыми словами: «В папке лежат письма с заявками. Разбери каждое и добавь строку в заявки.csv с колонками дата, имя, контакт, суть, источник. Чего нет — оставь пусто, ничего не выдумывай.»\n4. Проверьте на нескольких: откройте заявки.csv и сверьте 3–4 строки с исходными письмами — верно ли легли телефоны и суть запроса.\n5. Когда доверяете результату — попросите повторять: «Каждое утро проверяй папку новые-заявки и дописывай свежие в заявки.csv» (Claude умеет запускать задачи по расписанию).\n\n**Подвох.** Сам в вашу почту или CRM Claude не залезет без отдельного подключения-«переходника» (это называется MCP-коннектор — мостик к внешнему сервису) — на старте проще выгружать заявки в файл или настроить пересылку писем в папку. И перепроверяйте телефоны и суммы выборочно: модель может неверно распознать или «додумать» данные.",
    "tags": [
      "рецепт",
      "автоматизация"
    ],
    "source_url": "https://code.claude.com/docs/en/common-workflows#run-claude-on-a-schedule",
    "source_platform": "docs",
    "author": "Claude Code Docs",
    "published_at": "2026-07-13",
    "confidence": "high"
  },
  {
    "id": "47957409b6da",
    "date_found": "2026-07-13",
    "title": "Рецепт: безопасно доработать карточку товара / шаблон магазина",
    "summary": "Как поменять оформление или логику карточки товара, не уронив магазин: работаем на копии, включаем режим планирования и правим маленькими шагами с проверкой каждого изменения.",
    "details": "**Зачем.** Нужно поменять вид или логику карточки товара (добавить блок, поправить кнопку, показать остаток), но страшно: одно неверное движение — и оформление поедет на всех товарах или магазин ляжет.\n\n**Как.**\n1. Сначала копия. Если магазин под git (система версий с «точками возврата») — Claude сделает точку отката; если нет — просто скопируйте папку шаблона в `шаблон-копия` и работайте там. Правило: сперва на копии, потом на боевом.\n2. Включите режим планирования: нажмите Shift+Tab (или запустите `claude --permission-mode plan`). В нём Claude сначала расскажет, ЧТО собирается изменить, и не трогает файлы, пока вы не одобрите.\n3. Ставьте задачу мелко и конкретно: «Под ценой в карточке добавь строку \"Осталось N штук\". Покажи, какой файл и что меняешь, прежде чем менять.» Одна маленькая правка за раз, не «переделай всю карточку».\n4. Прочитайте план, одобрите. После правки откройте один тестовый товар в браузере: карточка открылась, ничего не съехало, кнопка работает.\n5. Если что-то не так — скажите «откати последнее изменение» или верните копию. Переносите на боевой магазин только после проверки.\n\n**Подвох.** Claude меняет код, но не видит ваш сайт глазами — как это выглядит в браузере, проверяете только вы. На закрытых платформах-конструкторах доступа к нужным файлам может не быть вовсе. Всегда держите бэкап и не выкладывайте непроверенное в часы продаж.",
    "tags": [
      "рецепт",
      "магазин"
    ],
    "source_url": "https://code.claude.com/docs/en/common-workflows#plan-before-editing",
    "source_platform": "docs",
    "author": "Claude Code Docs",
    "published_at": "2026-07-13",
    "confidence": "high"
  },
  {
    "id": "9cbbb9262bb3",
    "date_found": "2026-07-13",
    "title": "Рецепт: внутренний мини-инструмент вместо заказа за деньги",
    "summary": "Свой маленький инструмент под рутину (пересчитать прайс, переделать выгрузку, сгенерировать письма) вместо заказа у подрядчика. От формулировки задачи до рабочей версии за несколько шагов.",
    "details": "**Зачем.** Мелкая рутина — пересчитать прайс с наценкой, переделать выгрузку поставщика в нужный формат, сгенерировать однотипные письма. Заказывать это у подрядчика долго и дорого ради маленькой задачи. Сделаем свой простой инструмент.\n\n**Как.**\n1. Опишите одну задачу словами: что на входе, что хотите на выходе. Пример: «Вход — прайс поставщика в Excel с колонками название, цена, наличие. Выход — файл для загрузки в мой магазин, где цена уже +15%.»\n2. Дайте живой пример: положите в папку 1 реальный файл-образец входа (и, если есть, пример желаемого выхода). Образец важнее длинного описания.\n3. Скажите Claude: «Сделай простой инструмент, который берёт файл прайс.xlsx и выдаёт готовый файл по образцу. Объясни по-русски и без жаргона, как мне его запускать.»\n4. Проверьте на реальных данных: прогоните на 2–3 файлах и сверьте несколько строк вручную — особенно цены и формулу наценки.\n5. Когда работает — попросите памятку: «Запиши в файл памятка.txt по шагам, как запускать это в следующий раз.» Дальше пользуетесь сами.\n\n**Подвох.** Это личный инструмент «для себя», а не продукт для клиентов: без проверки на все случаи он может спотыкаться на необычных данных (пустые ячейки, другой формат файла). Начните с простого сценария и усложняйте по мере надобности, а формулы наценок и налогов сверяйте на калькуляторе.",
    "tags": [
      "рецепт",
      "автоматизация"
    ],
    "source_url": "https://code.claude.com/docs/en/common-workflows#prompt-recipes",
    "source_platform": "docs",
    "author": "Claude Code Docs",
    "published_at": "2026-07-13",
    "confidence": "high"
  },
  {
    "id": "988781d83ae5",
    "date_found": "2026-07-13",
    "title": "Рецепт: регулярный отчёт из нескольких источников в один файл",
    "summary": "Свести продажи, рекламу и остатки из разных выгрузок в один понятный отчёт — по расписанию или по кнопке, вместо ручной возни каждую неделю. Пошагово: как сложить данные и что попросить у Клода.",
    "details": "**Зачем.** Данные разбросаны: продажи в одной выгрузке, реклама в другой, остатки в третьей. Сводить их в один отчёт руками — полдня возни каждую неделю.\n\n**Как.**\n1. Соберите источники в одну папку. Выгрузите нужное в файлы: например `продажи.csv`, `реклама.csv`, `остатки.csv`, и договоритесь класть их в папку `отчёт/данные`.\n2. Опишите нужный отчёт: «Сделай отчёт за неделю: выручка, число заказов, средний чек, расходы на рекламу, товары с остатком меньше 5. Сохрани в отчёт.md, понятным языком, итоги сверху.»\n3. Запустите Claude в этой папке и дайте задание. Попросите показать черновик и объяснить, откуда взялась каждая цифра.\n4. Сверьте контрольные цифры: возьмите одну-две (например, общую выручку) и сравните с исходной выгрузкой — сходится ли.\n5. Поставьте на поток: «Каждый понедельник в 9 утра собирай такой отчёт из свежих файлов в папке» (Claude умеет по расписанию) — или запускайте одной командой, когда обновили файлы.\n\n**Подвох.** Отчёт точен ровно настолько, насколько свежи выгрузки: положили старый файл — получите старые цифры. Сам к вашим таблицам или 1С Claude не подключится без коннектора (MCP) — на старте файлы выгружаете вручную. Итоговые суммы для важных решений перепроверяйте.",
    "tags": [
      "рецепт",
      "автоматизация"
    ],
    "source_url": "https://code.claude.com/docs/en/common-workflows#run-claude-on-a-schedule",
    "source_platform": "docs",
    "author": "Claude Code Docs",
    "published_at": "2026-07-13",
    "confidence": "high"
  },
  {
    "id": "45a5db15c65f",
    "date_found": "2026-07-13",
    "title": "Рецепт: Telegram-уведомления о событиях бизнеса",
    "summary": "Получать сигналы бизнеса прямо в Telegram (новый заказ, сайт упал, кончается товар). Простыми словами: что за токен бота нужен, что сказать Клоду и как всё протестировать.",
    "details": "**Зачем.** Важные события — новый заказ, сайт упал, кончается товар — вы замечаете с опозданием, потому что не сидите в админке весь день. Хотим сигнал сразу в Telegram.\n\n**Как.**\n1. Заведите бота: в Telegram напишите @BotFather, создайте бота — он выдаст токен (длинная строка-пароль бота). Узнайте свой chat_id (например, через @userinfobot). Этих двух вещей хватает, чтобы слать себе сообщения.\n2. Решите, о чём сигналить и откуда это видно: например «если в остатки.csv есть товар с количеством меньше 3» или «если сайт не отвечает».\n3. Скажите Claude: «Сделай так, чтобы при <событие> мне приходило сообщение в Telegram. Токен бота и chat_id положу в отдельный файл-настройку. Объясни, как проверить.»\n4. Проверьте вручную: попросите «отправь тестовое сообщение сейчас» — оно должно прийти. Затем сымитируйте событие (поставьте в файле остаток 1) и убедитесь, что сигнал сработал.\n5. Поставьте на регулярную проверку: «Проверяй каждые 30 минут и пиши в Telegram, только если есть о чём» — чтобы не спамило.\n\n**Подвох.** Токен бота — это пароль: попадёт к чужим — будут слать от вашего имени. Держите его в отдельном файле и не выкладывайте в git или публично. И чтобы сигналы шли даже с выключенным компьютером, задачу нужно держать запущенной на сервере или в облачном расписании — на выключенном ПК локальная проверка не идёт.",
    "tags": [
      "рецепт",
      "автоматизация"
    ],
    "source_url": "https://code.claude.com/docs/en/common-workflows#run-claude-on-a-schedule",
    "source_platform": "docs",
    "author": "Claude Code Docs",
    "published_at": "2026-07-13",
    "confidence": "high"
  }
]
